{
  "conceptual_architecture": {
    "components": [
      {
        "dependencies": [],
        "name": "bin/_host/events.py (hook vocabulary)",
        "purpose": "Stdlib-only frozen boundary vocabulary \u2014 HookEventKind, ToolClass, and frozen dataclasses HookEvent, HookDecision (verdict allow/deny/warn; warn reserved), HookOutcome \u2014 with zero host imports and no I/O. The shared substrate every port depends on; ToolClass is the sole enforcement vocabulary."
      },
      {
        "dependencies": [
          "bin/_host/events.py (hook vocabulary)"
        ],
        "name": "bin/_host/shim.py + bin/hook-entry (Hook Shim port)",
        "purpose": "HostHookShim ABC (parse_event, render_decision, detect registry dispatch) + ClaudeHookShim reproducing the CC dialect exactly (exit-0-always; deny JSON on stdout). A single bin/hook-entry dispatcher routes detect \u2192 parse_event \u2192 pure HookEvent->HookDecision core hook \u2192 render_decision, cutting trampolines over one at a time (security-dispatch first) under the deny-parity gate; fail-open on parse error (ALLOW + log row)."
      },
      {
        "dependencies": [
          "bin/_host/events.py (hook vocabulary)"
        ],
        "name": "bin/_host/transcript.py (Transcript Provider port)",
        "purpose": "TranscriptProvider ABC + frozen FileTouch/SubagentRecord/SessionFacts (all fields optional). ClaudeTranscriptProvider absorbs the CC-specific jsonl scraping from hook_writer.py:41-281, reducing hook_writer to DB upserts that consume SessionFacts/SubagentRecord; never raises \u2014 degrades to empty SessionFacts (fail-open); prefers payload facts over scraping."
      },
      {
        "dependencies": [
          "bin/_host/events.py (Host-neutral hook event vocabulary)"
        ],
        "name": "bin/_host/transport.py (Model Transport port + ClaudeTransport)",
        "purpose": "Model Transport port: `ClaudeTransport` wraps (does not rewrite) `bin/_sdk_bridge.py` + `sdk_spawners`, ships the proven pure CLI-dialect `sanitize_schema` transform (build-now; not wired into any live transport in Phase 0 \u2014 CodexTransport deferred), scrubs the eight Claude Code session-identity env vars (`NESTED_SESSION_ENV_VARS`) at the `claude`-subprocess spawn boundary as a nested-session deadlock guard (explicit denylist, no-op when unset, preserves `CLAUDE_PLUGIN_*`), and keeps `_force_subscription_auth` internal; `iteration_loop.py` untouched."
      },
      {
        "dependencies": [
          "bin/_host/transport.py (Model Transport port + ClaudeTransport)"
        ],
        "name": "ClaudeModelCatalog + agents/_roster.json schema_version 4",
        "purpose": "ClaudeModelCatalog.resolve(role)->ModelPin for the full live role set (ModelRole derived empirically from DEFAULT_*_MODEL constants + roster). role\u2192pin data relocated into agents/_roster.json (schema_version 4, additive routing mapping); verifier pin fixed with env override ignored (verifier-independence contract); overridable OVERNIGHT_* precedence preserved via ModelPin.override_env; verifier.md model: stays the CC-native mirror."
      },
      {
        "dependencies": [
          "bin/_host/events.py (hook vocabulary)",
          "bin/_host/transport.py (Model Transport port + ClaudeTransport)",
          "ClaudeModelCatalog + agents/_roster.json schema_version 4"
        ],
        "name": "bin/_host/registry.py + bin/_host/routing.py (registry + StaticRouter)",
        "purpose": "Keyed register_transport/get_transport (a dict, 'claude' the only Phase 0 registrant) + frozen RouteQuery/RouteDecision, TransportRouter ABC, and StaticRouter (sole Phase 0 impl, always family='claude', rule_id='static-default'). Threads an optional router=StaticRouter() DI param through the three Tier-A seams (two_call/_qa.invoke _default_client, phase_spawn/opus_adapter.build_adapters); two-stage eligibility-filter-then-rule-pick contract; router selects family only, never overrides the verifier pin. Does not touch iteration_loop.py."
      },
      {
        "dependencies": [
          "bin/_host/registry.py + bin/_host/routing.py (registry + StaticRouter)"
        ],
        "name": "skills/*/SKILL.md routing metadata",
        "purpose": "Additive metadata: string-map block per skill (splock-route-intent, -default-family, -allowed-families, -requires, -subject-affinity) validated against the governed capability enum and registered families. Static per-unit facts only; no custom keys on commands/agents frontmatter; rollout gated one-skill-first behind the --strict smoke battery; records why the Agent Skills compatibility field was not used. Sealed path \u2014 sanctioned CLI edit."
      },
      {
        "dependencies": [],
        "name": "bin/_intent routing fields",
        "purpose": "Additive optional subjects field (+ --subjects CLI arg) and nullable model_family/routing_rule_id forensics keys on the JSONL row and marker payloads only; KIND left alone; subjects validated against a governed vocabulary knob (may start empty); no field named 'host'; MySQL/RDS columns deferred to recon G5."
      },
      {
        "dependencies": [],
        "name": "Reservations & transport inventory doc",
        "purpose": "Documentation-only reservations set naming deferred surfaces (routing.* settings namespace, routing_rules_v1.schema.json + its recorded design decisions, intent.routed enum member, agent_assignment.model_family bump, recon G5 migration, recon G4 validate_packaging port, the four-seam transport inventory, the no-routing-library-import policy with CVE-2026-42208 rationale, stickiness semantics). verification_kind: artifact_review."
      },
      {
        "dependencies": [
          "bin/_host/shim.py + bin/hook-entry (Hook Shim port)",
          "bin/_host/transcript.py (Transcript Provider port)",
          "bin/_host/transport.py (Model Transport port + ClaudeTransport)",
          "ClaudeModelCatalog + agents/_roster.json schema_version 4",
          "bin/_host/registry.py + bin/_host/routing.py (registry + StaticRouter)"
        ],
        "name": "tests/host_conformance/ suite",
        "purpose": "Incrementally-built conformance suite: golden HookEvent/HookOutcome fixtures, schema-sanitizer round-trips (byte-stable Claude dialect + proven CLI transform validated against the original strict schema), the catalog contract, and the byte-for-byte deny-parity gate. Encodes the global zero-behavior-change / CI-green acceptance gate; deny-parity gates SC2 cutover, sanitize round-trips gate SC4, catalog contract gates SC5."
      }
    ],
    "overview": "Three host-portability ports (HostHookShim, TranscriptProvider, ModelTransport) plus a shared stdlib-only boundary vocabulary (bin/_host/events.py), a keyed transport registry and a StaticRouter-only routing seam (bin/_host/registry.py + routing.py), a ClaudeModelCatalog with role\u2192pin data relocated into agents/_roster.json (schema_version 4), additive routing metadata in skill frontmatter and the intent registry, a documented reservations set, and an incrementally-built tests/host_conformance/ suite. Claude Code remains the sole live host; ClaudeTransport, ClaudeHookShim, and ClaudeTranscriptProvider WRAP (do not replace) the proven _sdk_bridge/sdk_spawners/hook plumbing; StaticRouter selects family only and can never override the fixed verifier pin. Every change is gated by zero-behavior-change-on-Claude-Code plus CI-green at each landing, with deny-parity, sanitize round-trips, and the catalog contract as the affirmative regression proofs. Suggested implplan phase grouping under the standing CI-green invariant: Phase 0a = SC1+SC4+SC5 (transport substrate); Phase 0b = SC2+SC3 (hook/transcript extraction behind the deny-parity gate); Phase 0c = SC6+SC7+SC8 (routing seam + metadata + registry fields); Phase 0d = SC9+SC10 close-out."
  },
  "non_goals": [
    "The Codex and Antigravity transport/shim/provider adapters themselves (later phases) \u2014 named as reservations only.",
    "The RuleRouter and its matching engine.",
    "routing_rules_v1.schema.json implementation (the matching engine + subjects-vocabulary governance engine).",
    "The MySQL/RDS column migration (recon G5 claude_session_id/parent_claude_session_id) \u2014 deferred to its own additive-migration slug.",
    "The agent_assignment.model_family orchestrator schema-version bump (post-Phase-2 orchestrator_v1.schema.json).",
    "The intent.routed event emission (member reserved in the EVENT enum only).",
    "The fleet transport port \u2014 bin/_fleet/spawn.py:104 build_child_argv seam is named in the inventory only; its port is deferred.",
    "Any HostTooling.validate_packaging() fourth port (recon G4, claude plugin validate seam, sdk_spawners.py:545).",
    "The MySQL model_family/routing_rule_id columns (future dynamic_model_routing slug; Phase 0 is JSONL + markers only).",
    "Phase-1 per-host packaging generators for commands/, skills/, agents/.",
    "Do NOT touch bin/_retry_loop/iteration_loop.py \u2014 already host-agnostic via injected spawn_*_fn/run_verify_fn callables (149\u2013153/321\u2013329).",
    "Under subscription-only policy (reconciliations 1\u20132), planner routing to Gemini is a permanent non-capability, not a deferral \u2014 a future Antigravity/Gemini transport is prose-roles-only with no structured-output capability."
  ],
  "phase": "Phase 2",